{
  "implementation": "sdk-node",
  "scenario": "resume",
  "status": "BLOCKED",
  "startedAt": "2026-09-18T11:10:43.812Z",
  "endedAt": "2026-09-18T11:10:45.532Z",
  "durationMs": 1720,
  "command": "npm run --prefix d1-spikes/sdk-node probe:resume",
  "exitCode": 2,
  "evidenceFiles": [
    "/Users/tal/Projects/TreeAI/.claude/worktrees/agent-afed5fd9ccdb61375/d1-spikes/evidence/sdk/runs/2026-09-18T11-09-33-297Z-78785/resume/events.jsonl"
  ],
  "observations": [
    "model: tal-token-plan-copy-copy/claude-fable-5 (thinking=off, source=first-available)",
    "direct Pi state/type access points used by the adapter: 10"
  ],
  "limitations": [
    "Agent D's shared JSON schemas (d1-spikes/schemas/) were not present; results were validated against the task-book field rules implemented in src/validate.ts instead (PENDING integration).",
    "adapter code: 298 code lines across 2 file(s) (src/pi-bridge.ts, src/scenarios/resume-child.ts); probe harness: 1781 code lines; direct Pi API surface: 11 entry points; Pi package version: 0.85.1",
    "Spike probe output, not a production adapter: no RuntimeAdapter, no TreeAI domain model.",
    "Fixture source is the local fallback (Agent D's shared fixtures/ not present yet)."
  ],
  "error": {
    "name": "BlockedError",
    "message": "phase A child process was blocked (BLOCKED_CREDENTIALS); see phase-a/ evidence",
    "stack": "BlockedError: phase A child process was blocked (BLOCKED_CREDENTIALS); see phase-a/ evidence\n    at Object.markBlocked (/Users/tal/Projects/TreeAI/.claude/worktrees/agent-afed5fd9ccdb61375/d1-spikes/sdk-node/src/runner.ts:117:13)\n    at runResumeScenario (/Users/tal/Projects/TreeAI/.claude/worktrees/agent-afed5fd9ccdb61375/d1-spikes/sdk-node/src/scenarios/resume.ts:48:9)\n    at process.processTicksAndRejections (node:internal/process/task_queues:104:5)\n    at async Object.exec (/Users/tal/Projects/TreeAI/.claude/worktrees/agent-afed5fd9ccdb61375/d1-spikes/sdk-node/src/run.ts:132:9)\n    at async runScenario (/Users/tal/Projects/TreeAI/.claude/worktrees/agent-afed5fd9ccdb61375/d1-spikes/sdk-node/src/runner.ts:134:5)\n    at async main (/Users/tal/Projects/TreeAI/.claude/worktrees/agent-afed5fd9ccdb61375/d1-spikes/sdk-node/src/run.ts:113:20)",
    "blockedReason": "BLOCKED_CREDENTIALS"
  }
}
