{
  "implementation": "sdk-node",
  "scenario": "resume",
  "status": "BLOCKED",
  "startedAt": "2026-09-18T11:58:57.713Z",
  "endedAt": "2026-09-18T11:58:59.747Z",
  "durationMs": 2034,
  "command": "npm run --prefix d1-spikes/sdk-node probe:resume",
  "exitCode": 2,
  "evidenceFiles": [
    "evidence/sdk/runs/2026-09-18T11-57-46-510Z-5120/resume/events.jsonl"
  ],
  "observations": [
    "model: tal-token-plan-copy-copy/claude-fable-5 (thinking=off, source=first-available)",
    "direct Pi state/type access points used by the adapter: 10"
  ],
  "limitations": [
    "adapter code: 298 code lines across 2 file(s) (src/pi-bridge.ts, src/scenarios/resume-child.ts); probe harness: 1815 code lines; direct Pi API surface: 11 entry points; Pi package version: 0.85.1",
    "Spike probe output, not a production adapter: no RuntimeAdapter, no TreeAI domain model."
  ],
  "error": {
    "name": "BlockedError",
    "message": "phase A child process was blocked (BLOCKED_CREDENTIALS); see phase-a/ evidence",
    "stack": "BlockedError: phase A child process was blocked (BLOCKED_CREDENTIALS); see phase-a/ evidence\n    at Object.markBlocked (~/Projects/TreeAI/d1-spikes/sdk-node/src/runner.ts:119:13)\n    at runResumeScenario (~/Projects/TreeAI/d1-spikes/sdk-node/src/scenarios/resume.ts:48:9)\n    at process.processTicksAndRejections (node:internal/process/task_queues:104:5)\n    at async Object.exec (~/Projects/TreeAI/d1-spikes/sdk-node/src/run.ts:133:9)\n    at async runScenario (~/Projects/TreeAI/d1-spikes/sdk-node/src/runner.ts:136:5)\n    at async main (~/Projects/TreeAI/d1-spikes/sdk-node/src/run.ts:114:20)",
    "blockedReason": "BLOCKED_CREDENTIALS"
  }
}
